ASIN,UPC,Title,Category,Amazon Price (£),Sales Rank,Est. Monthly Sales,Opportunity Score,Num Sellers,Num FBA Sellers,Buy Box Owner,Avg Price (90d) (£),Price Stability,Underserved,Supplier Name,Supplier Cost (£),Shipping Cost (£),Total Cost (£),Est. Profit/Unit (£),Profit Margin (%),ROI (%),Profit Potential (£),Notes
B09F6P576D,,"Guitar Lab Guitar Accessories Kit - Premium Metal Tin, Guitar Gifts for Men, Includes Guitar Strap, Capo, Tuner & Picks - Acoustic, Bass, Electric, Ukelele - Gift Set for Guitarists",Musical Instruments & DJ,26.99,1011,157,18.9,1,,,26.35,0.89,Yes,,,,,,,,3.83,
B09SFYSW66,,"31 Pcs Guitar Maintenance Tool Kit, POGOLAB Guitar Repairing Tool Kit with Carrying Bag for Ukulele Bass Mandolin Banjo, Gift for Music String Instrument Enthusiast",Musical Instruments & DJ,20.99,1473,121,18.8,1,,,18.16,0.89,Yes,,,,,,,,2.56,
B0DFCWK2C7,,"Havendi Clip-On Tuner I Guitar, Bass, Violin & Ukulele Tuner I Precise Tuning with Color Display & 360° Rotation I Includes Battery – Chromatic Guitar Tuner for Musicians",Musical Instruments & DJ,12.90,734,197,18.6,1,,,12.34,0.87,Yes,,,,,,,,0.86,
B0BF5W643L,,"KEPLIN Guitar Stand - Universal A Frame Black – Foldable Portable Floor Stand for Acoustic Electric & Bass Guitars, Lightweight Compact Guitar Holder for Home Studio Stage Practice Gig Musicians",Musical Instruments & DJ,9.99,29,1893,18.5,2,,,9.85,0.92,Yes,,,,,,,,0.26,
B0F17LB992,,"Guitar Cleaning Kit: Gloss Wax,Fret Polish,Fingerboard Lemon Oil,String Cleaner Oil,Masking Tape,Cleaning Brush & Cleaning Cloth Extends Fretboard and String Life",Musical Instruments & DJ,22.99,476,267,18.4,2,,,31.72,0.75,Yes,,,,,,,,2.98,
B088PQGSKB,,"72 PCS Guitar Accessories Kit, FOVERN1 Guitar Tools Set Including Guitar Picks, Capo, Tuner, Guitar Strings, 3 in 1String Winder,Bridge Pins, 6 String Bone Bridge Saddle and Nut, Finger Picks",Musical Instruments & DJ,15.99,2033,96,18.2,1,,,17.97,0.80,Yes,,,,,,,,1.51,
B08T9795HG,,"Fansjoy Violin Rosin 2 Pack, Natural Rosin with Case, Light Low Dust Rosin for Violin Viola and Cello Bows",Musical Instruments & DJ,9.99,901,170,18.2,1,,,9.81,0.83,Yes,,,,,,,,0.26,
B000NE3JZ6,,"D'Addario Violin Rosin - Cello Rosin - Kaplan Premium Light Rosin with Case for Violin, Viola, Cello - For Horsehair or Synthetic Bows",Musical Instruments & DJ,9.91,449,278,18.1,4,,,7.75,0.80,Yes,,,,,,,,0.24,
B0BKWNQZZH,,Hidersine 3VS Series Premium Violin Rosin. Slim Pack for easy transport and storage. Resin for Violin bows. Handmade in the UK.,Musical Instruments & DJ,8.29,159,575,18.1,2,,,7.41,0.85,Yes,,,,,,,,-0.17,
B000RXYVQO,,Hidersine 6V Deluxe Violin Rosin. Dark. Large size. Handmade in the UK. 30g rosin cake. Enhanced Bow control for proficient violinists. Resin for Violinists.,Musical Instruments & DJ,9.95,159,575,18.0,1,,,5.28,0.78,Yes,,,,,,,,0.25,
B0DSVP3LT1,,"Guitar Pick Case, Guitar Picks Holder Amp Speaker Guitar Pick Box | Guitar Pick Storage Container for Guitar Players Lovers | Guitar Picks Organizer | Simulation Speaker Desktop Ornaments Gift",Musical Instruments & DJ,7.49,370,318,17.8,2,,,7.97,0.82,Yes,,,,,,,,-0.45,
B004OSG7LK,,Hidersine 12V Violin Rosin. Small Size. Handmade in the UK since 1890. Approx 10g cake. Ideal as a first rosin for beginners and students.,Musical Instruments & DJ,7.95,159,575,17.8,1,,,3.05,0.78,Yes,,,,,,,,-0.28,
B087TMZ8Z7,,MOREYES Violin Rosin and Viola Rosin for Bows (1 PACK),Musical Instruments & DJ,6.99,1802,105,17.7,1,,,5.30,0.82,Yes,,,,,,,,-0.62,
B0CJ591KWN,,"SULIVES Guitar Tuner Clip On - Digital Tuners for Acoustic Guitar, Electronic Guitar, Bass, Violin, Ukulele - Lightweight, Accurate, and Essential Musical Accessory, SLV-PZ10503",,5.99,1712,187,17.5,1,,,6.08,0.86,Yes,,,,,,,,-0.97,
B003XDLT2E,,"Adagio Pro Mandolin String Set - Phosphor Bronze Wound (Standard Light.010 - .034 With Easy Fit Loop End Set) - 29.5"" Long Length Strings",Musical Instruments & DJ,6.49,1531,117,17.5,1,,,5.72,0.79,Yes,,,,,,,,-0.80,
B0BS8LCKF6,,"Vin beauty 3 Pcs 11.8x11.8inch Soft Microfiber Cleaning Cloth Musical Instruts Instrut Polishing Cloth Universal Clean Cloth Guitar Violin Piano Brass Trumpet Sax Flute, Blue",Musical Instruments & DJ,4.99,1145,144,17.2,1,,,4.34,0.90,Yes,,,,,,,,-1.32,
B097BTFK6D,,Rosin Natural for Violin Cello Viola Rosin Light Low Dust for Bows String Music Instrument Accessory Yellow with Case 3 Pack,Musical Instruments & DJ,4.99,358,326,17.1,1,,,4.70,0.87,Yes,,,,,,,,-1.32,
B07DG3D3G1,,"Vangoa 5 String Banjo Remo Head Closed Solid Back with beginner Kit, Tuner, Strap, Pick up, Strings, Picks and Bag",Musical Instruments & DJ,169.89,4767,53,17.0,1,,,166.57,0.92,Yes,,,,,,,,33.84,
B07RGVBY4V,,Vangoa A Style Mandolin Acoustic Electric Mandolins Instrument for Beginner Red Sunburst Mahogany with Gig Bag Picks Strings Tuner Strap,Musical Instruments & DJ,139.99,5139,50,16.8,1,,,99.97,0.92,Yes,,,,,,,,27.55,
B0FPG8DZRH,,Violin Bows Grip Correcting Device Beginner Enthusiasts Corrector Tool Finger Training Tool Violin Grip Enhancer,Musical Instruments & DJ,8.79,4060,59,16.7,3,,,8.79,1.00,Yes,,,,,,,,,
B0FNWSLXTH,,"132 Pcs Guitar Maintenance Tool Kit, Guitar Repair Tool Kit with Carry Bag, Guitar Care Cleaning Accessories, for Ukulele Bass Mandolin Banjo, Perfect Gift for Music String Instrument Enthusiast",Musical Instruments & DJ,27.99,5007,51,16.7,1,,,28.62,0.94,Yes,,,,,,,,4.04,
B08RYQ9F3R,,"Lyre Harp,16 String Mahogany Lyre Instrument with Tuning Wrench,Replace String Set,Manual Book (16 string-Begonia)",Musical Instruments & DJ,49.99,5136,50,16.7,1,,,47.98,0.91,Yes,,,,,,,,8.65,
B087M27985,,"Vangoa Mandolin Instrument A Style Sunburst Acoustic Mandolin for Beginners with Tuner, Strings, Gig Bag, Picks",Musical Instruments & DJ,109.98,5138,50,16.6,1,,,97.10,0.87,Yes,,,,,,,,21.25,
B0G5PXVJBN,,72Pcs Guitar Maintenance Kit with Winder: Lifegogo Guitar Tool Kit with Carry Bag Picks Bridge Pins Hex Wrenches String Action Ruler Guitars Setup Kits for Music Instrument Beginner,Musical Instruments & DJ,22.99,6196,44,16.5,1,,,22.99,1.00,Yes,,,,,,,,2.98,
B07RBPYPDC,,"Donner Mandolin Instrument Black Mandolin Instrument Set for Beginner Adult Mahogany A Style with Tuner, String, Gig Bag, Guitar Picks (DML-100B)",Musical Instruments & DJ,59.49,5715,46,16.5,1,,,76.08,0.91,Yes,,,,,,,,10.65,
B09NHRW8BL,,"2Pcs Glass Slide and Stainless Steel Slide Guitar Finger Slide Bottleneck Slides for Electric Guitar Bass Acoustic Guitar Stringed Instruments Medium,6 cm",Musical Instruments & DJ,6.29,240,431,16.4,1,,,7.78,0.52,Yes,,,,,,,,-0.86,
B08L8RPP2K,,"Violin Fingerboard Sticker, Removable 4/4 Violin Finger Position Marker Water Resistant Violin Music Note Stickers For Beginners Practice",Musical Instruments & DJ,5.09,2264,89,16.3,2,,,4.60,0.77,Yes,,,,,,,,-1.28,
B07BRWQPN1,,Vangoa Banjolele Concert Banjo Ukulele 4 String 23 Inch Travel Banjo Portable Kit for Beginners with Extra Strings Strap Pick-up Picks Tuner and Carry Case,Musical Instruments & DJ,104.99,6905,41,16.3,1,,,95.51,0.90,Yes,,,,,,,,20.20,
B002A14CXI,,"Hidersine Hidersol Varnish Cleaner and Polish for Violin, Viola, Cello and Double Bass. Remove Rosin and Dirt from Valuable Musical Instruments. Made in The UK Since 1890. 50ml Bottle.",Musical Instruments & DJ,8.99,3848,61,16.1,2,,,4.54,0.80,Yes,,,,,,,,0.04,
B0FK4X6X3C,,"16 PCS Violin Strings Full Set, Universal Carbon Steel Copper Wound with Copper-Plated Ball End Classic Steel Strings for Instruments 4/4 3/4 1/2 1/4 Violin",Musical Instruments & DJ,5.59,3534,65,16.0,1,,,6.11,0.95,Yes,,,,,,,,-1.11,
B0FMR7TN8D,,"3Pcs Violin Rosin,Natural Rosin for Violin Viola and Cello,Light and Low Dust Ro/sin,Cello R/osin,Vi/olin Accessories,String Instrument Accessories,R/osin Perfect for Professional and Beginner",Musical Instruments & DJ,4.99,3082,72,16.0,1,,,5.85,0.93,Yes,,,,,,,,-1.32,
B0BYJCK368,,"4Pcs Violin Strings,Size 4/4 and 3/4 String Universal Full Set (G D A E) Violin,String Instrument Accessories,Classic Silver Strings Steel Core with Nickel Plated Ball Head for Violin Instruments",Musical Instruments & DJ,3.39,1307,131,15.8,1,,,3.47,0.85,Yes,,,,,,,,-1.89,
B09BCCWNSM,,"Quick Change Capo for 6-String Acoustic & Electric Guitars, Classical Guitar & Ukulele - Black",Musical Instruments & DJ,3.99,17,2752,15.8,1,,,4.27,0.69,Yes,,,,,,,,-1.68,
B000WB2K28,,"The Hiderpaste by Hidersine Peg Paste for Violins & String Instuments - Stop your Pegs from Slipping - Perfect for Violins, Violas, Cellos and other String Instruments with Tuning Pegs",Musical Instruments & DJ,5.39,2231,90,15.5,3,,,4.06,0.52,Yes,,,,,,,,-1.19,
B0GCY6HZL7,,"BESPORTBLE 2Pcs Clarinet Cleaning Brush Kit with Absorbent Bristles and Flexible Rod, Wind Instrument Care Tool for Clarinet Inner Tube Maintenance and Music Instrument Cleaning",Musical Instruments & DJ,10.09,8755,34,15.4,1,,,9.69,0.96,Yes,,,,,,,,0.28,
B0FSS9WWDT,,"Violin Rosin - Natural Resin for Violin, Viola, and Cello Bows - Light Low Dust Rosin for String Instruments",Musical Instruments & DJ,4.29,3623,64,15.2,1,,,4.29,0.94,Yes,,,,,,,,-1.56,
B014I0DFO0,,Elagon UK (SCF) Pro Care Kit Accessories - String Cleaner & String Lubricant Stick. Helps To Maximize Playing Comfort And Speed. For All Guitars + Bass and Other Stringed Instruments.,Musical Instruments & DJ,4.99,1699,109,14.8,2,,,11.69,0.25,No,,,,,,,,-1.32,
B082VWWSZJ,,"Fantastic Finger Guide for Violins | Stringed Musical Instruments | Fingerboard and Fretboard Stickers for Learning All Notes | Kids/Adult Beginner Violin Finger Guide | Play or Fiddle, 4/4-Size",Musical Instruments & DJ,7.65,2066,95,14.6,1,,,12.75,0.03,No,,,,,,,,-0.40,
B07GDNQQQL,,"PPpanda Guitar Picks 24 pcs, Guitar Plectrums for Your Electric, Acoustic, or Bass Guitar,0.46mm-Thin,0.71mm-Medium,0.96mm-Heavy",Musical Instruments & DJ,3.99,9,4295,14.6,1,,,3.82,0.38,No,,,,,,,,-1.68,
B0GRCBJ53M,,"Guitar – 80g Creamy Wax | Gui-tar Shine Wax, String Instrument Care, Music Instrument Nourishing | Restore Shine Guitar Wa-x For Monthly Routine, Pre-Concert, Beginner",Musical Instruments & DJ,8.28,23993,17,14.5,1,,,8.28,1.00,No,,,,,,,,-0.17,
B0CZP4W28K,,ifundom Guitar Cleaner Kit Fret Floss String Cleaner Lubricant Maintenance Brush Tool for Strings Music Instruments,Musical Instruments & DJ,8.59,19371,19,14.2,2,,,8.14,0.88,No,,,,,,,,-0.07,
B0FTG3C1H5,,"Trumpet Care Kit | Musical Instrument Restoration Tool - Brass Trumpet Instrument Cleaning Kit,for Professionals, Students, Beginners, Performers, Music Players",Musical Instruments & DJ,14.49,41202,11,14.2,1,,,13.40,0.88,No,,,,,,,,1.20,
B0G4DPV3YG,,"3Pcs Violin Rosin, Perfect for Professional and Beginner Musicians, Light Low Dust, For Violin Viola and Cello Bows String Music Instrument Accessory",Musical Instruments & DJ,4.59,11046,29,13.6,1,,,4.25,0.95,No,,,,,,,,-1.47,
B073ZPTM1F,,"Fender FT-1 Pro Clip-On Tuner Gen 1, For Electric, Acoustic & Bass Guitars & Ukuleles, Black",Musical Instruments & DJ,15.29,48,1330,13.5,7,,,9.85,0.83,No,,,,,,,,1.37,
B0G4RD5KYC,,"Guitar String Cleaner & Fingerboard Maintenance Kit - Professional Instrument Cleaning Tool for Neck, Fretboard & Strings | Music Gear Care Supplies for Guitar, Bass, Violin & Ukulele",Musical Instruments & DJ,5.99,44379,11,13.4,1,,,6.29,0.95,No,,,,,,,,-0.97,
B0FWRKSQR4,,"3pcs Violin Rosin,Natural Violin Rosin,Light Low Dust Ro/sin for Vio/lin Viola Cello Bow,Ro/sin for Vio/lin Strings and Other Instrument Accessories,String Instrument Accessories for Musicians",Musical Instruments & DJ,3.59,6717,41,12.7,1,,,4.64,0.74,No,,,,,,,,-1.81,
0739096362,,Mini Music Guides -- Guitar Repair & Maintenance: Guitar Care and Gear Essentials,Books,8.95,919962,1,4.1,4,,,5.96,0.81,No,,,,,,,,0.04,
B09P3YJJ4M,,"Joyzan Soft Clarinet Cleaner, Mouthpiece Brush Microfiber Cleaning Saver Care Kit Cleaner Protector Pad Tool Bristles Sax Trumpet Brushes Multifunction Accessory for Woodwinds Music Instruments",Musical Instruments & DJ,4.89,66071,8,3.5,1,,,5.71,0.73,No,,,,,,,,-1.35,
